{
  "schema": "turn/1",
  "source_id": "c1f0a7de-6a3b-4a0e-b6a1-0f6f3d6a1c01",
  "occurred_at": "2026-09-14T14:57:02Z",
  "data": {
    "conversation_ref": "5d0f4f0e-6f5b-4d0b-8f0e-6a4f3c2b1a09",
    "database_ref": "7a1f3c52-9d4e-4b6a-8c0d-1e2f3a4b5c6d",
    "user_ref": "0123456789abcdef0123456789abcdef",
    "provider": "claude",
    "model": "claude-sonnet-4-6",
    "finish_reason": "end_turn",
    "input_tokens": 1200,
    "output_tokens": 340,
    "cache_read_input_tokens": 800,
    "cache_creation_input_tokens": 0,
    "cost_usd": "0.012345",
    "tools": [
      { "name": "consultar_datos", "status": "ok" },
      { "name": "consultar_conocimiento", "status": "ok", "tipo": "modulo" }
    ],
    "latency_ms": 4210,
    "action": "send"
  }
}
